{
  "task_id": "move_book_demo",
  "task_name": "move_book",
  "instruction": "Move the blue book onto the green target area.",
  "robot": {
    "name": "panda_allegro_right",
    "arm": "Franka Panda",
    "hand": "Wonik Allegro Hand V3 right",
    "dof": 23
  },
  "simulator": {
    "backend": "mujoco",
    "entrypoint": {
      "config_mapping_key": "move_book",
      "xml_path": "dexjoco/dexjoco/sim/envs/xmls/arena_arm_hand_move_book.xml",
      "env_class": "dexjoco.sim.envs.panda_move_book_env.PandaMoveBookGymEnv"
    }
  },
  "objects": [
    {
      "name": "book",
      "role": "manipulated_object",
      "type": "box_composite",
      "pose": [-0.33, -0.18, 0.945, 1.0, 0.0, 0.0, 0.0],
      "size": [0.216, 0.156, 0.046],
      "material": "blue cover with page block"
    },
    {
      "name": "goal_zone",
      "role": "target_region",
      "type": "flat_box",
      "pose": [0.12, 0.22, 0.925],
      "size": [0.26, 0.20, 0.008],
      "material": "translucent green"
    },
    {
      "name": "table",
      "role": "support_surface",
      "type": "box_table",
      "pose": [-0.15, 0.0, 0.89],
      "size": [0.90, 1.70, 0.06]
    }
  ],
  "success_condition": {
    "type": "object_near_site",
    "object": "book",
    "target": "goal_center",
    "radius": 0.08,
    "description": "Success when the book center is within 8 cm of the goal site in XY."
  },
  "static_review": {
    "must_be_visible": ["book", "goal_zone", "robot hand", "table"],
    "must_be_reachable": ["book", "goal_zone"],
    "common_failure_modes": [
      "Book starts under or intersecting the table.",
      "Goal is outside reachable workspace.",
      "Camera does not show the manipulated object.",
      "Object geometry is too thin or too slippery to manipulate."
    ]
  },
  "generator": {
    "kind": "seed_example",
    "version": 1
  }
}
